{
    "testName": "test Sproc does thing",
    "sutSchema": "mySchemaName1",
    "sutObject": "myViewName1",
    "expectedColumns": [
        {
            "columnName": "id",
            "sqlDataType": "NVARCHAR(4000)",
            "values": [
                 "1"
                ,"2"
                ,"3"
                ,"4"
            ]
        },
        {
            "columnName": "payments",
            "sqlDataType": "DECIMAL(38,20)",
            "values": [
                 "0.0"
                ,"0.1"
                ,"2.0"
                ,"9.0"
            ]
        }
    ],
    "sprocUnderTestSchema": "maintenance",
    "sprocUnderTestObject": "sampleSproc_usp",
    "sprocUnderTestParameters": [
        {
            "parameterName": "firstParam",
            "parameterValue": "0"
        },
        {
            "parameterName": "debugMode",
            "parameterValue": "NULL"
        }
    ]
    ,
    "fakes": [
        {
            "schemaName": "dbo"
            ,"objectName": "sourcetable"
            ,"columns": [
                {
                    "columnName": "id",
                    "values": [
                        "1"
                        ,"2"
                        ,"3"
                        ,"3"
                        ,"4"
                        ,"4"
                        ,"4"
                        ,"4"
                    ]
                },
                {
                    "columnName": "payments",
                    "values": [
                         "0.0"
                        ,"0.1"
                        ,"3.0"
                        ,"-1.0"
                        ,"9.0"
                        ,"-9.0"
                        ,"4.0"
                        ,"5.0"
                    ]
                }
            ]
        }
    ]

}